name,age,job,address,phone
Tessy Wahyuni Riwayati Hartati,69,Pelawak,Jalan rusak 145,08098999
Sutarno,56,Best of the Best Traditional Magician,Dari Jawa,0
Sudjiwo Tedjo Separo Gendeng,54,Presiden Republik Jancukers, Sonya Ruri 76,02260858026
H. Bolot,74,Ketua RT,Ciputat Tangerang Selatan,0218923343
S. M. Kartosoewirjo,112,Imam Negara Islam Indonesia,Gunung Geber Madjalaja,08228392219
Maridjan,90,Juru Kunci Hargo Merapi,Ds Kinahrejo Ngayogyakarta,02748819923
Mbah Surip,59,Penyanyi,Kuburan Kampung Rawa Depok,082738119
Mang Wadjim,78,Petani,Jalan Trikora Majalengka Kulon,0233284253
